<?xml version="1.0" encoding="utf-8"?>
<adposition xmlns="http://www.w3schools.com/adposition"
          xmlns:xsi="http://www.w3.org/2001/XMLSchema-instance"
          xsi:schemaLocation="http://www.w3schools.com/adposition.xsd">

    <rei>
        <kanji furi="みち">道</kanji>
        <example>で</example>
        <kanji furi="さいふ">財布</kanji>
        <example>を</example>
        <kanji furi="ひろ">拾</kanji>いました。
    </rei>
    <mondai>
        <kanji furi="みち">予定</kanji>
        <shitsumon>が</shitsumon>
        <kanji furi="みち">変</kanji>わったら、
        <kanji furi="みち">連絡</kanji>してください。
    </mondai>
</adposition>
